{
  "$schema": "Schemas/requirements.schema.json",
  "schemaVersion": 1,
  "documentID": "AH-REQUIREMENTS-V1",
  "sourceSpecification": {
    "path": "spec.md",
    "sha256": "d7cc338f104818b3cf28c492c0b8543f96e45640dceb520f1d13481a652e6fb3",
    "capturedAtUTC": "2026-10-24T18:18:13Z"
  },
  "requirements": [
    {
      "id": "AH-INFRA-001",
      "area": "infrastructure",
      "title": "Specification identity is pinned",
      "statement": "Every verification document identifies the exact spec.md content by path, SHA-256, and source anchor so stale evidence cannot silently satisfy a changed specification.",
      "status": "active",
      "riskTier": "P0",
      "specAnchors": [
        {
          "section": "27",
          "heading": "Test strategy",
          "lineStart": 1287,
          "lineEnd": 1479
        }
      ],
      "platforms": [
        "all"
      ],
      "verificationTiers": [
        "every-change",
        "pull-request",
        "nightly",
        "release-candidate"
      ],
      "testIDs": [
        "AHT-INFRA-001"
      ],
      "requiredEvidence": [
        "Verifier output containing the matched spec SHA-256"
      ]
    },
    {
      "id": "AH-INFRA-002",
      "area": "infrastructure",
      "title": "Verification JSON is schema-valid",
      "statement": "Requirements, tests, quarantine, semantic registries, scripted model fixtures, app-container fixtures, and coverage documents validate against their checked-in Draft 2020-12 schemas.",
      "status": "active",
      "riskTier": "P0",
      "specAnchors": [
        {
          "section": "27.5",
          "heading": "Coverage and release gates",
          "lineStart": 1405,
          "lineEnd": 1479
        }
      ],
      "platforms": [
        "all"
      ],
      "verificationTiers": [
        "every-change",
        "pull-request",
        "nightly",
        "release-candidate"
      ],
      "testIDs": [
        "AHT-INFRA-001"
      ],
      "requiredEvidence": [
        "Per-document schema validation report"
      ]
    },
    {
      "id": "AH-INFRA-003",
      "area": "infrastructure",
      "title": "Traceability is bidirectional",
      "statement": "Every requirement references known tests, every test references known requirements, identifiers are unique, and retired or unknown links fail verification.",
      "status": "active",
      "riskTier": "P0",
      "specAnchors": [
        {
          "section": "27",
          "heading": "Test strategy",
          "lineStart": 1287,
          "lineEnd": 1479
        }
      ],
      "platforms": [
        "all"
      ],
      "verificationTiers": [
        "every-change",
        "pull-request",
        "nightly",
        "release-candidate"
      ],
      "testIDs": [
        "AHT-INFRA-002"
      ],
      "requiredEvidence": [
        "Zero unknown, duplicate, stale, or unmapped IDs"
      ]
    },
    {
      "id": "AH-INFRA-004",
      "area": "infrastructure",
      "title": "Semantic registries are complete and enumerable",
      "statement": "The run-state, transition, approval-decision, and stable-boundary registries are machine-enumerable and their declared completeness is verified.",
      "status": "active",
      "riskTier": "P0",
      "specAnchors": [
        {
          "section": "27.1",
          "heading": "Deterministic unit and property tests",
          "lineStart": 1298,
          "lineEnd": 1335
        }
      ],
      "platforms": [
        "all"
      ],
      "verificationTiers": [
        "every-change",
        "pull-request",
        "nightly",
        "release-candidate"
      ],
      "testIDs": [
        "AHT-INFRA-003"
      ],
      "requiredEvidence": [
        "Finite cell, rule, unique-winner, dead-rule, security-invariant, and cross-document registry report"
      ]
    },
    {
      "id": "AH-INFRA-005",
      "area": "infrastructure",
      "title": "Deterministic fixtures are valid",
      "statement": "Scripted model and app-container fixtures have fixed identities, deterministic inputs, explicit behavioral oracles, and no dependency on prior test ordering.",
      "status": "active",
      "riskTier": "P1",
      "specAnchors": [
        {
          "section": "27.1",
          "heading": "Deterministic unit and property tests",
          "lineStart": 1298,
          "lineEnd": 1335
        },
        {
          "section": "27.3",
          "heading": "Real-device matrix",
          "lineStart": 1357,
          "lineEnd": 1387
        }
      ],
      "platforms": [
        "all"
      ],
      "verificationTiers": [
        "every-change",
        "pull-request",
        "release-candidate"
      ],
      "testIDs": [
        "AHT-INFRA-004"
      ],
      "requiredEvidence": [
        "Fixture schema report and unique fixed seeds"
      ]
    },
    {
      "id": "AH-INFRA-006",
      "area": "infrastructure",
      "title": "Coverage policy is enforceable",
      "statement": "Coverage floors, semantic completeness gates, mutation gates, pending baselines, and exclusions are represented without claiming unavailable evidence.",
      "status": "active",
      "riskTier": "P0",
      "specAnchors": [
        {
          "section": "27.5",
          "heading": "Coverage and release gates",
          "lineStart": 1405,
          "lineEnd": 1479
        }
      ],
      "platforms": [
        "all"
      ],
      "verificationTiers": [
        "every-change",
        "pull-request",
        "nightly",
        "release-candidate"
      ],
      "testIDs": [
        "AHT-INFRA-005"
      ],
      "requiredEvidence": [
        "Coverage policy, baseline, and exclusion validation"
      ]
    },
    {
      "id": "AH-INFRA-007",
      "area": "infrastructure",
      "title": "Quarantine cannot hide critical failures",
      "statement": "P0 and security, persistence, approval, deletion, recovery, lifecycle, and required device tests cannot be quarantined; other entries expire within seven days.",
      "status": "active",
      "riskTier": "P0",
      "specAnchors": [
        {
          "section": "27.5",
          "heading": "Coverage and release gates",
          "lineStart": 1405,
          "lineEnd": 1479
        }
      ],
      "platforms": [
        "all"
      ],
      "verificationTiers": [
        "every-change",
        "pull-request",
        "nightly",
        "release-candidate"
      ],
      "testIDs": [
        "AHT-INFRA-006"
      ],
      "requiredEvidence": [
        "Quarantine policy report with expiry evaluation"
      ]
    },
    {
      "id": "AH-INFRA-008",
      "area": "infrastructure",
      "title": "Missing verification evidence fails",
      "statement": "Empty test discovery, unexpected skips, crashes, timeouts, missing result bundles, or missing coverage reports fail their gate.",
      "status": "active",
      "riskTier": "P0",
      "specAnchors": [
        {
          "section": "27.5",
          "heading": "Coverage and release gates",
          "lineStart": 1405,
          "lineEnd": 1479
        }
      ],
      "platforms": [
        "all"
      ],
      "verificationTiers": [
        "pull-request",
        "nightly",
        "release-candidate"
      ],
      "testIDs": [
        "AHT-INFRA-007"
      ],
      "requiredEvidence": [
        "Negative verifier fixtures for missing discovery and result evidence"
      ]
    },
    {
      "id": "AH-ARCH-001",
      "area": "architecture",
      "title": "MLX-free dependency boundaries",
      "statement": "AgentContracts is dependency-light, AgentSandboxAPI depends only on AgentContracts, and AgentRuntime contains no SwiftUI, MLX, llama.cpp, EventKit, CoreLocation, or private sandbox dependency.",
      "status": "active",
      "riskTier": "P0",
      "specAnchors": [
        {
          "section": "6",
          "heading": "Target package boundaries",
          "lineStart": 146,
          "lineEnd": 195
        }
      ],
      "platforms": [
        "swiftpm",
        "ios",
        "macos"
      ],
      "verificationTiers": [
        "every-change",
        "pull-request"
      ],
      "testIDs": [
        "AHT-ARCH-001"
      ],
      "requiredEvidence": [
        "Package graph assertion and MLX-free builds"
      ]
    },
    {
      "id": "AH-ARCH-002",
      "area": "architecture",
      "title": "Forbidden effect runtimes and dependencies remain absent",
      "statement": "Dynamic Workflows may evaluate the bounded, effect-free JavaScript orchestration ABI in section 34, but the release contains no Python/WASM/arbitrary-code workflow runtime, static DAG authoring system, production sandbox substitute, direct filesystem/shell/network/secret authority, or silent cloud fallback; every child effect crosses the shared harness boundary.",
      "status": "active",
      "riskTier": "P0",
      "specAnchors": [
        {
          "section": "4",
          "heading": "Non-goals",
          "lineStart": 98,
          "lineEnd": 113
        },
        {
          "section": "23",
          "heading": "Unified staged and Dynamic Workflows boundary",
          "lineStart": 1172,
          "lineEnd": 1239
        }
      ],
      "platforms": [
        "swiftpm",
        "ios",
        "macos"
      ],
      "verificationTiers": [
        "pull-request",
        "release-candidate"
      ],
      "testIDs": [
        "AHT-ARCH-002"
      ],
      "requiredEvidence": [
        "Forbidden dependency and symbol scan"
      ]
    },
    {
      "id": "AH-IDENTITY-001",
      "area": "identity",
      "title": "Durable identities are strongly typed",
      "statement": "Runs, steps, requests, invocations, approvals, artifacts, events, handles, commands, messages, and conversations use non-interchangeable stable identifiers.",
      "status": "active",
      "riskTier": "P0",
      "specAnchors": [
        {
          "section": "7",
          "heading": "Core terminology and identity",
          "lineStart": 196,